{
  "schema_version": 1,
  "name": "operate-infinitas-skill",
  "publisher": "lvxiaoer",
  "qualified_name": "lvxiaoer/operate-infinitas-skill",
  "version": "0.1.0",
  "status": "incubating",
  "summary": "Teach OpenClaw, Codex, and Claude Code how to operate inside the infinitas-skill repository.",
  "owner": "lvxiaoer",
  "owners": [
    "lvxiaoer"
  ],
  "author": "lvxiaoer",
  "maintainers": [
    "lvxiaoer"
  ],
  "tags": [
    "registry",
    "openclaw",
    "codex",
    "claude-code",
    "operations"
  ],
  "agent_compatible": [
    "openclaw",
    "claude",
    "claude-code",
    "codex"
  ],
  "derived_from": null,
  "replaces": null,
  "visibility": "private",
  "review_state": "draft",
  "risk_level": "low",
  "requires": {
    "tools": [
      "read",
      "exec"
    ],
    "bins": [
      "git"
    ],
    "env": []
  },
  "entrypoints": {
    "skill_md": "SKILL.md"
  },
  "tests": {
    "smoke": "tests/smoke.md"
  },
  "distribution": {
    "installable": true,
    "channel": "git"
  },
  "depends_on": [],
  "conflicts_with": []
}
