{
  "schema_version": 1,
  "name": "operate-infinitas-skill",
  "publisher": "lvxiaoer",
  "qualified_name": "lvxiaoer/operate-infinitas-skill",
  "version": "0.1.2",
  "status": "active",
  "summary": "Teach OpenClaw, Codex, and Claude Code how to operate inside the infinitas-skill repository.",
  "owner": "lvxiaoer",
  "owners": [
    "lvxiaoer"
  ],
  "author": "lvxiaoer",
  "maintainers": [
    "lvxiaoer"
  ],
  "tags": [
    "registry",
    "openclaw",
    "codex",
    "claude-code",
    "operations"
  ],
  "agent_compatible": [
    "openclaw",
    "claude",
    "claude-code",
    "codex"
  ],
  "derived_from": null,
  "replaces": null,
  "visibility": "private",
  "maturity": "stable",
  "quality_score": 90,
  "capabilities": [
    "repo-operations",
    "release-guidance",
    "registry-debugging"
  ],
  "use_when": [
    "Need to operate inside the infinitas-skill repository",
    "Need guidance on registry workflows, planning files, or release discipline"
  ],
  "avoid_when": [
    "Need a general-purpose Git helper outside this repository"
  ],
  "runtime_assumptions": [
    "A Git checkout of infinitas-skill is available",
    "Repository scripts can be executed from the workspace"
  ],
  "review_state": "approved",
  "risk_level": "low",
  "requires": {
    "tools": [
      "read",
      "exec"
    ],
    "bins": [
      "git"
    ],
    "env": []
  },
  "entrypoints": {
    "skill_md": "SKILL.md"
  },
  "tests": {
    "smoke": "tests/smoke.md"
  },
  "distribution": {
    "installable": true,
    "channel": "git"
  },
  "depends_on": [],
  "conflicts_with": []
}
