{
  "schema_version": 1,
  "name": "scripted-skill",
  "version": "0.1.0",
  "status": "incubating",
  "summary": "Starter template for script-backed private skills",
  "owner": "replace-me",
  "owners": [
    "replace-me"
  ],
  "author": "replace-me",
  "maintainers": [],
  "tags": [],
  "agent_compatible": [
    "openclaw",
    "claude-code",
    "codex"
  ],
  "derived_from": null,
  "replaces": null,
  "visibility": "private",
  "maturity": "prototype",
  "quality_score": 0,
  "capabilities": [],
  "use_when": [],
  "avoid_when": [],
  "runtime_assumptions": [],
  "review_state": "draft",
  "risk_level": "medium",
  "requires": {
    "tools": [],
    "bins": [],
    "env": []
  },
  "entrypoints": {
    "skill_md": "SKILL.md"
  },
  "tests": {
    "smoke": "tests/smoke.md"
  },
  "distribution": {
    "installable": true,
    "channel": "git"
  },
  "depends_on": [],
  "conflicts_with": []
}
